name,description,content_id,organisation_content_ids
"2012 Olympic and Paralympic legacy","The governments policy on 2012 olympic and paralympic legacy",5d37821b-7631-11e4-a3cb-005056011aef,96ae61d6-c2a1-48cb-8e67-da9d105ae381|fd62c5a4-714d-47fe-a612-595d1739251c|9adfc4ed-9f6c-4976-a6d8-18d34356367c|06056197-bc69-4147-aa28-070bca132178|b045c8df-d3c4-4219-88d8-264dc9ee5cc8
"Academies and free schools","The governments policy on academies and free schools",5e11d60a-7631-11e4-a3cb-005056011aef,ebd15ade-73b2-4eaf-b1c3-43034a42eb37
"Access to financial services","The governments policy on access to financial services",5e12543d-7631-11e4-a3cb-005056011aef,1994e0e4-bd19-4966-bbd7-f293d6e90a6b
"Access to higher education","The governments policy on access to higher education",5c768145-7631-11e4-a3cb-005056011aef,569a9ee5-c195-4b7f-b9dc-edc17a09113f
"Access to the countryside","The governments policy on access to the countryside",5d5e9adb-7631-11e4-a3cb-005056011aef,de4e9dc6-cca4-43af-a594-682023b84d6c|16628142-57b2-4611-bc03-5912785acee3|d3ce4ba7-bc75-46b4-89d9-38cb3240376d
"Accessible transport","The governments policy on accessible transport",5c768624-7631-11e4-a3cb-005056011aef,4c717efc-f47b-478e-a76d-ce1ae0af1946|b969a617-7c4b-4d3b-97ef-41656ef688c9
"Administrative justice reform","The governments policy on administrative justice reform",5efbcd19-7631-11e4-a3cb-005056011aef,dcc907d6-433c-42df-9ffb-d9c68be5dc4d|6f757605-ab8f-4b62-84e4-99f79cf085c2
"Afghanistan","The governments policy on afghanistan",5c7633e8-7631-11e4-a3cb-005056011aef,96ae61d6-c2a1-48cb-8e67-da9d105ae381|db994552-7644-404d-a770-a2fe659c661f|9adfc4ed-9f6c-4976-a6d8-18d34356367c|d994e55c-48c9-4795-b872-58d8ec98af12
"Alcohol sales","The governments policy on alcohol sales",5d5e9dbc-7631-11e4-a3cb-005056011aef,06056197-bc69-4147-aa28-070bca132178
"Animal and plant health","The governments policy on animal and plant health",5d5e93a9-7631-11e4-a3cb-005056011aef,de4e9dc6-cca4-43af-a594-682023b84d6c|4ad67f14-6f9c-4fa4-80ab-687b6d81ea6f
"Animal research and testing","The governments policy on animal research and testing",5d5ea01b-7631-11e4-a3cb-005056011aef,06056197-bc69-4147-aa28-070bca132178
"Animal welfare","The governments policy on animal welfare",5d63cb05-7631-11e4-a3cb-005056011aef,de4e9dc6-cca4-43af-a594-682023b84d6c|4ad67f14-6f9c-4fa4-80ab-687b6d81ea6f
"Armed forces and Ministry of Defence reform","The governments policy on armed forces and ministry of defence reform",5c80e4ce-7631-11e4-a3cb-005056011aef,d994e55c-48c9-4795-b872-58d8ec98af12
"Armed forces covenant","The governments policy on armed forces covenant",5e12a2f8-7631-11e4-a3cb-005056011aef,d994e55c-48c9-4795-b872-58d8ec98af12|33cf4faf-f09b-457d-b516-0704547e1f89
"Armed forces support for activities in the UK","The governments policy on armed forces support for activities in the uk",5c8015d4-7631-11e4-a3cb-005056011aef,d994e55c-48c9-4795-b872-58d8ec98af12
"Arts and culture","The governments policy on arts and culture",5d37abd7-7631-11e4-a3cb-005056011aef,fd62c5a4-714d-47fe-a612-595d1739251c|ebd15ade-73b2-4eaf-b1c3-43034a42eb37
"Automatic enrolment in workplace pensions","The governments policy on automatic enrolment in workplace pensions",5d65d112-7631-11e4-a3cb-005056011aef,b548a09f-8b35-4104-89f4-f1a40bf3136d
"Aviation and airports","The governments policy on aviation and airports",5c768539-7631-11e4-a3cb-005056011aef,4c717efc-f47b-478e-a76d-ce1ae0af1946|1400bcfb-c0f2-4e1c-b8fb-1135a2b83088|5f8931ae-479b-473c-b6b8-967fed23d10a
"Bank regulation","The governments policy on bank regulation",5e124b00-7631-11e4-a3cb-005056011aef,569a9ee5-c195-4b7f-b9dc-edc17a09113f|1994e0e4-bd19-4966-bbd7-f293d6e90a6b
"Biodiversity and ecosystems","The governments policy on biodiversity and ecosystems",5d5e981f-7631-11e4-a3cb-005056011aef,de4e9dc6-cca4-43af-a594-682023b84d6c|d3ce4ba7-bc75-46b4-89d9-38cb3240376d
"Bovine tuberculosis (bovine TB)","The governments policy on bovine tuberculosis (bovine tb)",5d5e929f-7631-11e4-a3cb-005056011aef,de4e9dc6-cca4-43af-a594-682023b84d6c
"British nationals overseas","The governments policy on british nationals overseas",5c7653b1-7631-11e4-a3cb-005056011aef,9adfc4ed-9f6c-4976-a6d8-18d34356367c|d994e55c-48c9-4795-b872-58d8ec98af12
"Broadband investment","The governments policy on broadband investment",5d37b44a-7631-11e4-a3cb-005056011aef,fd62c5a4-714d-47fe-a612-595d1739251c
"Building regulation","The governments policy on building regulation",5c7692f9-7631-11e4-a3cb-005056011aef,2e7868a8-38f5-4ff6-b62f-9a15d1c22d28|0eb3df59-aad1-4cb2-89f5-1de8032d0095
"Business and the environment","The governments policy on business and the environment",5d5e9050-7631-11e4-a3cb-005056011aef,de4e9dc6-cca4-43af-a594-682023b84d6c|d65d4203-01f5-4920-a3b1-f614bfd8e83e|16628142-57b2-4611-bc03-5912785acee3
"Business enterprise","The governments policy on business enterprise",5c7f2a11-7631-11e4-a3cb-005056011aef,569a9ee5-c195-4b7f-b9dc-edc17a09113f|1994e0e4-bd19-4966-bbd7-f293d6e90a6b
"Business regulation","The governments policy on business regulation",5c7657ab-7631-11e4-a3cb-005056011aef,569a9ee5-c195-4b7f-b9dc-edc17a09113f
"Business tax reform","The governments policy on business tax reform",5e1253ae-7631-11e4-a3cb-005056011aef,1994e0e4-bd19-4966-bbd7-f293d6e90a6b
"Cancer research and treatment","The governments policy on cancer research and treatment",5d3b75de-7631-11e4-a3cb-005056011aef,7cd6bf12-bbe9-4118-8523-f927b0442156
"Carers' health","The governments policy on carers' health",5d3b5d66-7631-11e4-a3cb-005056011aef,7cd6bf12-bbe9-4118-8523-f927b0442156
"Central government efficiency","The governments policy on central government efficiency",5d2b59a2-7631-11e4-a3cb-005056011aef,96ae61d6-c2a1-48cb-8e67-da9d105ae381|ec61fac5-95e9-46bb-8429-7129aab6d96d|af07d5a5-df63-4ddc-9383-6a666845ebe9
"Child maintenance reform","The governments policy on child maintenance reform",5d359757-7631-11e4-a3cb-005056011aef,b548a09f-8b35-4104-89f4-f1a40bf3136d
"Childcare and early education","The governments policy on childcare and early education",5d646654-7631-11e4-a3cb-005056011aef,ebd15ade-73b2-4eaf-b1c3-43034a42eb37|1994e0e4-bd19-4966-bbd7-f293d6e90a6b
"Children outside mainstream education","The governments policy on children outside mainstream education",5dbe05ae-7631-11e4-a3cb-005056011aef,ebd15ade-73b2-4eaf-b1c3-43034a42eb37
"Children's health","The governments policy on children's health",5d5f8d42-7631-11e4-a3cb-005056011aef,ebd15ade-73b2-4eaf-b1c3-43034a42eb37|7cd6bf12-bbe9-4118-8523-f927b0442156
"Children's social workers","The governments policy on children's social workers",5d646b62-7631-11e4-a3cb-005056011aef,ebd15ade-73b2-4eaf-b1c3-43034a42eb37
"Choice in health and social care","The governments policy on choice in health and social care",5d635d59-7631-11e4-a3cb-005056011aef,7cd6bf12-bbe9-4118-8523-f927b0442156
"City Deal","The governments policy on city deal",5d2b5a98-7631-11e4-a3cb-005056011aef,96ae61d6-c2a1-48cb-8e67-da9d105ae381|5a1467ef-2946-4d06-831d-8153d25d6ff4
"Civil justice reform","The governments policy on civil justice reform",3f1dc53a-732b-41ff-83ae-8d93fffb1a7c,dcc907d6-433c-42df-9ffb-d9c68be5dc4d
"Civil service reform","The governments policy on civil service reform",5d2b5b43-7631-11e4-a3cb-005056011aef,96ae61d6-c2a1-48cb-8e67-da9d105ae381
"Climate change adaptation","The governments policy on climate change adaptation",5d5e8e59-7631-11e4-a3cb-005056011aef,de4e9dc6-cca4-43af-a594-682023b84d6c|16628142-57b2-4611-bc03-5912785acee3|d3ce4ba7-bc75-46b4-89d9-38cb3240376d
"Climate change impact in developing countries","The governments policy on climate change impact in developing countries",5d2b69f0-7631-11e4-a3cb-005056011aef,db994552-7644-404d-a770-a2fe659c661f|d65d4203-01f5-4920-a3b1-f614bfd8e83e|9adfc4ed-9f6c-4976-a6d8-18d34356367c
"Climate change international action","The governments policy on climate change international action",5c83248d-7631-11e4-a3cb-005056011aef,de4e9dc6-cca4-43af-a594-682023b84d6c|db994552-7644-404d-a770-a2fe659c661f|d65d4203-01f5-4920-a3b1-f614bfd8e83e|9adfc4ed-9f6c-4976-a6d8-18d34356367c
"Common Agricultural Policy reform","The governments policy on common agricultural policy reform",5d5e8efc-7631-11e4-a3cb-005056011aef,de4e9dc6-cca4-43af-a594-682023b84d6c|e8fae147-6232-4163-a3f1-1c15b755a8a4|8bf5624b-dec2-44fa-9b6c-daed166333a5|d3ce4ba7-bc75-46b4-89d9-38cb3240376d
"Communications and telecomms","The governments policy on communications and telecomms",5d37b495-7631-11e4-a3cb-005056011aef,fd62c5a4-714d-47fe-a612-595d1739251c
"Community integration","The governments policy on community integration",5c769488-7631-11e4-a3cb-005056011aef,2e7868a8-38f5-4ff6-b62f-9a15d1c22d28
"Company law reform","The governments policy on company law reform",5c82e1ff-7631-11e4-a3cb-005056011aef,569a9ee5-c195-4b7f-b9dc-edc17a09113f
"Compassionate care in the NHS","The governments policy on compassionate care in the nhs",5d29c84e-7631-11e4-a3cb-005056011aef,7cd6bf12-bbe9-4118-8523-f927b0442156
"Competition law","The governments policy on competition law",5c84ae9f-7631-11e4-a3cb-005056011aef,569a9ee5-c195-4b7f-b9dc-edc17a09113f|c39170d6-85de-408e-87cf-37d0005bb791
"Conflict in fragile states","The governments policy on conflict in fragile states",5c764f11-7631-11e4-a3cb-005056011aef,db994552-7644-404d-a770-a2fe659c661f|9adfc4ed-9f6c-4976-a6d8-18d34356367c|d994e55c-48c9-4795-b872-58d8ec98af12
"Conservation of historic buildings and monuments","The governments policy on conservation of historic buildings and monuments",5d37ae96-7631-11e4-a3cb-005056011aef,fd62c5a4-714d-47fe-a612-595d1739251c
"Constitutional reform","The governments policy on constitutional reform",5d2b5d58-7631-11e4-a3cb-005056011aef,96ae61d6-c2a1-48cb-8e67-da9d105ae381
"Consumer credit market","The governments policy on consumer credit market",5c846c32-7631-11e4-a3cb-005056011aef,1994e0e4-bd19-4966-bbd7-f293d6e90a6b
"Consumer protection","The governments policy on consumer protection",5c782deb-7631-11e4-a3cb-005056011aef,569a9ee5-c195-4b7f-b9dc-edc17a09113f
"Corporate accountability","The governments policy on corporate accountability",5c6f9ce8-7631-11e4-a3cb-005056011aef,569a9ee5-c195-4b7f-b9dc-edc17a09113f|1994e0e4-bd19-4966-bbd7-f293d6e90a6b
"Council Tax reform","The governments policy on council tax reform",5c76958b-7631-11e4-a3cb-005056011aef,2e7868a8-38f5-4ff6-b62f-9a15d1c22d28
"Counter-terrorism","The governments policy on counter-terrorism",5c764f67-7631-11e4-a3cb-005056011aef,96ae61d6-c2a1-48cb-8e67-da9d105ae381|9adfc4ed-9f6c-4976-a6d8-18d34356367c|06056197-bc69-4147-aa28-070bca132178|dcc907d6-433c-42df-9ffb-d9c68be5dc4d
"Crime prevention","The governments policy on crime prevention",5dbc0a8d-7631-11e4-a3cb-005056011aef,06056197-bc69-4147-aa28-070bca132178
"Criminal justice reform","The governments policy on criminal justice reform",5d8c2e89-7631-11e4-a3cb-005056011aef,dcc907d6-433c-42df-9ffb-d9c68be5dc4d
"Cyber security","The governments policy on cyber security",5d2b393c-7631-11e4-a3cb-005056011aef,96ae61d6-c2a1-48cb-8e67-da9d105ae381|569a9ee5-c195-4b7f-b9dc-edc17a09113f|9adfc4ed-9f6c-4976-a6d8-18d34356367c|354bc716-9654-4b5e-b24d-172588e24ca3
"Deficit reduction","The governments policy on deficit reduction",5dc19857-7631-11e4-a3cb-005056011aef,1994e0e4-bd19-4966-bbd7-f293d6e90a6b
"Dementia","The governments policy on dementia",5d2c798b-7631-11e4-a3cb-005056011aef,7cd6bf12-bbe9-4118-8523-f927b0442156
"Drug misuse and dependency","The governments policy on drug misuse and dependency",5d645426-7631-11e4-a3cb-005056011aef,7cd6bf12-bbe9-4118-8523-f927b0442156|06056197-bc69-4147-aa28-070bca132178
"Economic development in coastal and seaside areas","The governments policy on economic development in coastal and seaside areas",5c768f2a-7631-11e4-a3cb-005056011aef,2e7868a8-38f5-4ff6-b62f-9a15d1c22d28|5ddb26f6-caad-4b14-97a7-fabcfa25d4bc
"Economic growth in Wales","The governments policy on economic growth in wales",5d63ad0d-7631-11e4-a3cb-005056011aef,4f9fe232-e7a2-48e8-99b1-8f7828680493
"Economic growth in developing countries","The governments policy on economic growth in developing countries",5d2b65f2-7631-11e4-a3cb-005056011aef,db994552-7644-404d-a770-a2fe659c661f|1994e0e4-bd19-4966-bbd7-f293d6e90a6b
"Economic growth in rural areas","The governments policy on economic growth in rural areas",5d5e9b62-7631-11e4-a3cb-005056011aef,de4e9dc6-cca4-43af-a594-682023b84d6c|d3ce4ba7-bc75-46b4-89d9-38cb3240376d
"Education in developing countries","The governments policy on education in developing countries",5d2b6567-7631-11e4-a3cb-005056011aef,db994552-7644-404d-a770-a2fe659c661f
"Education of disadvantaged children","The governments policy on education of disadvantaged children",5d646146-7631-11e4-a3cb-005056011aef,ebd15ade-73b2-4eaf-b1c3-43034a42eb37
"Elite sports performance","The governments policy on elite sports performance",5d377ef9-7631-11e4-a3cb-005056011aef,fd62c5a4-714d-47fe-a612-595d1739251c|7d365379-2e0e-4b45-a8e6-3de68d8dbbf0
"Emergency planning","The governments policy on emergency planning",5c768de5-7631-11e4-a3cb-005056011aef,96ae61d6-c2a1-48cb-8e67-da9d105ae381|2e7868a8-38f5-4ff6-b62f-9a15d1c22d28|16628142-57b2-4611-bc03-5912785acee3|4082456a-b07f-4a36-8fc1-f063b8921243
"Employment","The governments policy on employment",5d2c72d2-7631-11e4-a3cb-005056011aef,b548a09f-8b35-4104-89f4-f1a40bf3136d|1994e0e4-bd19-4966-bbd7-f293d6e90a6b
"End of life care","The governments policy on end of life care",5d5e1199-7631-11e4-a3cb-005056011aef,7cd6bf12-bbe9-4118-8523-f927b0442156
"Energy and climate change: evidence and analysis","The governments policy on energy and climate change: evidence and analysis",5d05b4c3-7631-11e4-a3cb-005056011aef,d65d4203-01f5-4920-a3b1-f614bfd8e83e|cbc24f1d-6413-40a3-8ff7-fbb5bbbc7889|5da4ab94-39b2-40cf-99ae-1af4f6b4206d
"Energy demand reduction in industry, business and the public sector","The governments policy on energy demand reduction in industry, business and the public sector",5c76969f-7631-11e4-a3cb-005056011aef,de4e9dc6-cca4-43af-a594-682023b84d6c|d65d4203-01f5-4920-a3b1-f614bfd8e83e|cbc24f1d-6413-40a3-8ff7-fbb5bbbc7889|16628142-57b2-4611-bc03-5912785acee3
"Energy efficiency in buildings","The governments policy on energy efficiency in buildings",5c769275-7631-11e4-a3cb-005056011aef,2e7868a8-38f5-4ff6-b62f-9a15d1c22d28
"Energy industry and infrastructure licensing and regulation","The governments policy on energy industry and infrastructure licensing and regulation",5c76973e-7631-11e4-a3cb-005056011aef,d65d4203-01f5-4920-a3b1-f614bfd8e83e|844d0880-14b1-4de1-bfb6-f233f3d5ae1d|ffc70f77-4ee8-4a6b-a5f2-54657ee4f4c6|16628142-57b2-4611-bc03-5912785acee3|5416838d-cdd3-4172-94db-caafd966fdf3
"Environmental quality","The governments policy on environmental quality",5d5e9189-7631-11e4-a3cb-005056011aef,de4e9dc6-cca4-43af-a594-682023b84d6c
"European funds","The governments policy on european funds",5d37d041-7631-11e4-a3cb-005056011aef,569a9ee5-c195-4b7f-b9dc-edc17a09113f|2e7868a8-38f5-4ff6-b62f-9a15d1c22d28|de4e9dc6-cca4-43af-a594-682023b84d6c|b548a09f-8b35-4104-89f4-f1a40bf3136d|1994e0e4-bd19-4966-bbd7-f293d6e90a6b
"European single market","The governments policy on european single market",5c7652fa-7631-11e4-a3cb-005056011aef,569a9ee5-c195-4b7f-b9dc-edc17a09113f|9adfc4ed-9f6c-4976-a6d8-18d34356367c|1994e0e4-bd19-4966-bbd7-f293d6e90a6b
"Export controls","The governments policy on export controls",5c8eaea1-7631-11e4-a3cb-005056011aef,569a9ee5-c195-4b7f-b9dc-edc17a09113f|db994552-7644-404d-a770-a2fe659c661f|d65d4203-01f5-4920-a3b1-f614bfd8e83e|9adfc4ed-9f6c-4976-a6d8-18d34356367c|d994e55c-48c9-4795-b872-58d8ec98af12
"Exports and inward investment","The governments policy on exports and inward investment",5c765455-7631-11e4-a3cb-005056011aef,569a9ee5-c195-4b7f-b9dc-edc17a09113f|9adfc4ed-9f6c-4976-a6d8-18d34356367c|b045c8df-d3c4-4219-88d8-264dc9ee5cc8|c4e41647-ad69-4e96-843b-05fa7867bbc0
"Falkland Islanders' right to self-determination","The governments policy on falkland islanders' right to self-determination",5c764ec2-7631-11e4-a3cb-005056011aef,9adfc4ed-9f6c-4976-a6d8-18d34356367c|d994e55c-48c9-4795-b872-58d8ec98af12
"Family justice system","The governments policy on family justice system",5d8c2daa-7631-11e4-a3cb-005056011aef,ebd15ade-73b2-4eaf-b1c3-43034a42eb37|dcc907d6-433c-42df-9ffb-d9c68be5dc4d
"Farming industry regulation","The governments policy on farming industry regulation",5d5e8ea2-7631-11e4-a3cb-005056011aef,de4e9dc6-cca4-43af-a594-682023b84d6c
"Financial services regulation","The governments policy on financial services regulation",5db8ff72-7631-11e4-a3cb-005056011aef,1994e0e4-bd19-4966-bbd7-f293d6e90a6b
"Fire prevention and rescue","The governments policy on fire prevention and rescue",5c768e37-7631-11e4-a3cb-005056011aef,2e7868a8-38f5-4ff6-b62f-9a15d1c22d28|4082456a-b07f-4a36-8fc1-f063b8921243
"Flooding and coastal change","The governments policy on flooding and coastal change",5d5e9c4b-7631-11e4-a3cb-005056011aef,de4e9dc6-cca4-43af-a594-682023b84d6c|16628142-57b2-4611-bc03-5912785acee3
"Food and farming industry","The governments policy on food and farming industry",5d63cb4d-7631-11e4-a3cb-005056011aef,de4e9dc6-cca4-43af-a594-682023b84d6c|e8fae147-6232-4163-a3f1-1c15b755a8a4|d3ce4ba7-bc75-46b4-89d9-38cb3240376d
"Forests and woodland","The governments policy on forests and woodland",5d5e8f8a-7631-11e4-a3cb-005056011aef,de4e9dc6-cca4-43af-a594-682023b84d6c
"Free trade","The governments policy on free trade",5c84cec1-7631-11e4-a3cb-005056011aef,569a9ee5-c195-4b7f-b9dc-edc17a09113f|db994552-7644-404d-a770-a2fe659c661f
"Freight","The governments policy on freight",5c768686-7631-11e4-a3cb-005056011aef,4c717efc-f47b-478e-a76d-ce1ae0af1946|d39237a5-678b-4bb5-a372-eb2cb036933d
"Freshwater fisheries","The governments policy on freshwater fisheries",5d5e9923-7631-11e4-a3cb-005056011aef,de4e9dc6-cca4-43af-a594-682023b84d6c|16628142-57b2-4611-bc03-5912785acee3
"Further education and training","The governments policy on further education and training",5c777573-7631-11e4-a3cb-005056011aef,569a9ee5-c195-4b7f-b9dc-edc17a09113f|ebd15ade-73b2-4eaf-b1c3-43034a42eb37
"Gambling regulation","The governments policy on gambling regulation",5d37af45-7631-11e4-a3cb-005056011aef,fd62c5a4-714d-47fe-a612-595d1739251c
"Governance in developing countries","The governments policy on governance in developing countries",5d2b677a-7631-11e4-a3cb-005056011aef,db994552-7644-404d-a770-a2fe659c661f
"Government buying","The governments policy on government buying",5d2b59f6-7631-11e4-a3cb-005056011aef,96ae61d6-c2a1-48cb-8e67-da9d105ae381|ec61fac5-95e9-46bb-8429-7129aab6d96d|8437e374-dfa7-4b52-bd88-ebc29032a9e4
"Government spending","The governments policy on government spending",5e0df781-7631-11e4-a3cb-005056011aef,1994e0e4-bd19-4966-bbd7-f293d6e90a6b
"Government transparency and accountability","The governments policy on government transparency and accountability",5d278051-7631-11e4-a3cb-005056011aef,96ae61d6-c2a1-48cb-8e67-da9d105ae381
"Greenhouse gas emissions","The governments policy on greenhouse gas emissions",5c83b3e2-7631-11e4-a3cb-005056011aef,de4e9dc6-cca4-43af-a594-682023b84d6c|d65d4203-01f5-4920-a3b1-f614bfd8e83e|cbc24f1d-6413-40a3-8ff7-fbb5bbbc7889|16628142-57b2-4611-bc03-5912785acee3
"HS2: high speed rail","The governments policy on hs2: high speed rail",5c76826d-7631-11e4-a3cb-005056011aef,4c717efc-f47b-478e-a76d-ce1ae0af1946|b80fab8b-6ed4-426a-bb8d-f4b614437671
"Harmful drinking","The governments policy on harmful drinking",5d6456ee-7631-11e4-a3cb-005056011aef,7cd6bf12-bbe9-4118-8523-f927b0442156
"Health and safety reform","The governments policy on health and safety reform",5d359cf6-7631-11e4-a3cb-005056011aef,b548a09f-8b35-4104-89f4-f1a40bf3136d
"Health and social care integration","The governments policy on health and social care integration",5d606d99-7631-11e4-a3cb-005056011aef,7cd6bf12-bbe9-4118-8523-f927b0442156
"Health emergency planning","The governments policy on health emergency planning",5d635fc7-7631-11e4-a3cb-005056011aef,96ae61d6-c2a1-48cb-8e67-da9d105ae381|7cd6bf12-bbe9-4118-8523-f927b0442156
"Health in developing countries","The governments policy on health in developing countries",5d2b6674-7631-11e4-a3cb-005056011aef,db994552-7644-404d-a770-a2fe659c661f
"High streets and town centres","The governments policy on high streets and town centres",5c768f81-7631-11e4-a3cb-005056011aef,2e7868a8-38f5-4ff6-b62f-9a15d1c22d28
"Higher education participation","The governments policy on higher education participation",5c7683a9-7631-11e4-a3cb-005056011aef,569a9ee5-c195-4b7f-b9dc-edc17a09113f
"Homebuying","The governments policy on homebuying",5c768ba6-7631-11e4-a3cb-005056011aef,2e7868a8-38f5-4ff6-b62f-9a15d1c22d28|1994e0e4-bd19-4966-bbd7-f293d6e90a6b|5ddb26f6-caad-4b14-97a7-fabcfa25d4bc
"House building","The governments policy on house building",5c768c4e-7631-11e4-a3cb-005056011aef,2e7868a8-38f5-4ff6-b62f-9a15d1c22d28|5ddb26f6-caad-4b14-97a7-fabcfa25d4bc
"Household energy","The governments policy on household energy",5c7696ef-7631-11e4-a3cb-005056011aef,2e7868a8-38f5-4ff6-b62f-9a15d1c22d28|b548a09f-8b35-4104-89f4-f1a40bf3136d|d65d4203-01f5-4920-a3b1-f614bfd8e83e|844d0880-14b1-4de1-bfb6-f233f3d5ae1d
"Housing for older and vulnerable people","The governments policy on housing for older and vulnerable people",5c783029-7631-11e4-a3cb-005056011aef,2e7868a8-38f5-4ff6-b62f-9a15d1c22d28|5ddb26f6-caad-4b14-97a7-fabcfa25d4bc
"Human rights internationally","The governments policy on human rights internationally",5c764d55-7631-11e4-a3cb-005056011aef,fd62c5a4-714d-47fe-a612-595d1739251c|9adfc4ed-9f6c-4976-a6d8-18d34356367c|3df55660-43a9-4494-8146-a0a492a975b6
"Humanitarian emergencies","The governments policy on humanitarian emergencies",5d2b64c9-7631-11e4-a3cb-005056011aef,db994552-7644-404d-a770-a2fe659c661f
"Hunger and malnutrition in developing countries","The governments policy on hunger and malnutrition in developing countries",5d2b68e5-7631-11e4-a3cb-005056011aef,db994552-7644-404d-a770-a2fe659c661f
"Immigration and borders","The governments policy on immigration and borders",5d5e9f6c-7631-11e4-a3cb-005056011aef,06056197-bc69-4147-aa28-070bca132178|3808b369-f1d6-44d3-a5b2-a7b7ac931106|04148522-b0c1-4137-b687-5f3c3bdd561a
"Industrial strategy","The governments policy on industrial strategy",5d3bf551-7631-11e4-a3cb-005056011aef,569a9ee5-c195-4b7f-b9dc-edc17a09113f
"Inspections of schools, colleges and children's services","The governments policy on inspections of schools, colleges and children's services",5d646277-7631-11e4-a3cb-005056011aef,ebd15ade-73b2-4eaf-b1c3-43034a42eb37
"International defence commitments","The governments policy on international defence commitments",5c801ee8-7631-11e4-a3cb-005056011aef,d994e55c-48c9-4795-b872-58d8ec98af12
"Iran's nuclear programme","The governments policy on iran's nuclear programme",5c764e27-7631-11e4-a3cb-005056011aef,9adfc4ed-9f6c-4976-a6d8-18d34356367c
"Justice system transparency","The governments policy on justice system transparency",5d8c2c30-7631-11e4-a3cb-005056011aef,dcc907d6-433c-42df-9ffb-d9c68be5dc4d
"Knife, gun and gang crime","The governments policy on knife, gun and gang crime",5d5e9e64-7631-11e4-a3cb-005056011aef,06056197-bc69-4147-aa28-070bca132178
"Labour market reform","The governments policy on labour market reform",5c82dfb0-7631-11e4-a3cb-005056011aef,569a9ee5-c195-4b7f-b9dc-edc17a09113f|6667cce2-e809-4e21-ae09-cb0bdc1ddda3
"Legal aid reform","The governments policy on legal aid reform",5d8c2d15-7631-11e4-a3cb-005056011aef,dcc907d6-433c-42df-9ffb-d9c68be5dc4d
"Library services","The governments policy on library services",5d37b1b1-7631-11e4-a3cb-005056011aef,fd62c5a4-714d-47fe-a612-595d1739251c
"Local Enterprise Partnerships (LEPs) and enterprise zones","The governments policy on local enterprise partnerships (leps) and enterprise zones",5c768ed7-7631-11e4-a3cb-005056011aef,569a9ee5-c195-4b7f-b9dc-edc17a09113f|2e7868a8-38f5-4ff6-b62f-9a15d1c22d28|5ddb26f6-caad-4b14-97a7-fabcfa25d4bc
"Local council transparency and accountability","The governments policy on local council transparency and accountability",5c768cf6-7631-11e4-a3cb-005056011aef,2e7868a8-38f5-4ff6-b62f-9a15d1c22d28
"Local government spending","The governments policy on local government spending",5c777669-7631-11e4-a3cb-005056011aef,2e7868a8-38f5-4ff6-b62f-9a15d1c22d28
"Local transport","The governments policy on local transport",5c768356-7631-11e4-a3cb-005056011aef,4c717efc-f47b-478e-a76d-ce1ae0af1946
"Localism","The governments policy on localism",5c769403-7631-11e4-a3cb-005056011aef,2e7868a8-38f5-4ff6-b62f-9a15d1c22d28
"Long term health conditions","The governments policy on long term health conditions",5d3c0ebd-7631-11e4-a3cb-005056011aef,7cd6bf12-bbe9-4118-8523-f927b0442156
"Looked-after children and adoption","The governments policy on looked-after children and adoption",5d64654b-7631-11e4-a3cb-005056011aef,ebd15ade-73b2-4eaf-b1c3-43034a42eb37
"Low carbon technologies","The governments policy on low carbon technologies",5c7695d8-7631-11e4-a3cb-005056011aef,d65d4203-01f5-4920-a3b1-f614bfd8e83e|16628142-57b2-4611-bc03-5912785acee3
"Major project management","The governments policy on major project management",5d2b5ae5-7631-11e4-a3cb-005056011aef,96ae61d6-c2a1-48cb-8e67-da9d105ae381|1994e0e4-bd19-4966-bbd7-f293d6e90a6b|ec61fac5-95e9-46bb-8429-7129aab6d96d
"Management of the European Regional Development Fund","The governments policy on management of the european regional development fund",5c768e88-7631-11e4-a3cb-005056011aef,2e7868a8-38f5-4ff6-b62f-9a15d1c22d28
"Marine environment","The governments policy on marine environment",5d5e94fa-7631-11e4-a3cb-005056011aef,de4e9dc6-cca4-43af-a594-682023b84d6c|8d56bb52-2f79-4b6d-9fc6-6d7dcc4f7586|d3ce4ba7-bc75-46b4-89d9-38cb3240376d
